,name,image,keys,points,calories,summary
725,Air Fryer Chicken Nuggets,https://www.skinnytaste.com/wp-content/uploads/2018/01/Air-Fryer-Chicken-Nuggets-1-6-260x390.jpg,"['AF', 'KF', 'Q']",3,188.0,"Homemade Air Fryer Chicken Nuggets made with boneless skinless chicken breasts coated in breadcrumbs, pankp and Parmesan cheese then air fried until crisp, golden and delicious!"
726,Breakfast Egg Rolls,https://www.skinnytaste.com/wp-content/uploads/2021/01/Breakfast-Egg-Roll-5-260x390.jpg,"['AF', 'DF', 'FM', 'KF', 'MP', 'Q']",5,240.0,"These Breakfast Egg Rolls, loaded with eggs, sausage, and veggies cooked in the oven or air fryer, are a fun twist on an egg sandwich. Perfect for making ahead and reheating as needed."
727,Top 25 Most Popular Skinnytaste Recipes of 2020,https://www.skinnytaste.com/wp-content/uploads/2020/12/TOP-2020_A-260x390.jpg,[],,,"A list of the most popular recipes from 2020, see if your favorite made the list!"
728,Drunken Shrimp,https://www.skinnytaste.com/wp-content/uploads/2009/04/Drunken-Shrimp-7-260x390.jpg,"['GF', 'LC', 'Q']",2,175.0,"Drunken shrimp just got a makeover. Not sure if you can call this drunken since I significantly cut down the wine, but the shrimp aren’t 100% sober either."
729,Virgin Bloody Mary,https://www.skinnytaste.com/wp-content/uploads/2020/12/Virgin-Bloody-Mary-7-260x390.jpg,"['DF', 'GF', 'Q', 'V']",1,33.0,"Craving a Bloody Mary but doing a dry challenge? Make this Virgin Bloody Mary, also known as the Virgin Mary, and you won’t miss the vodka!"
730,Sauteed Collard Greens with Bacon,https://www.skinnytaste.com/wp-content/uploads/2011/01/Collard-Greens-and-Bacon-9-260x390.jpg,"['DF', 'GF', 'LC', 'Q']",2,73.0,"Thinly sliced collard greens sautéed with bacon, garlic, and olive oil is the perfect side dish for New Year’s Day."
731,Fudgy Flourless Crinkle Brownie Cookies with Sea Salt,https://www.skinnytaste.com/wp-content/uploads/2020/12/Fudgy-Flourless-Chocolate-Crinkle-Cookies-6-260x390.jpg,"['DF', 'GF', 'HF', 'KF']",5,207.0,"These flourless Brownie Crinkle Cookies are rich and fudgy like a brownie but shaped like a cookie. Made lighter, grain-free and gluten-free with almond meal and they have no oil or butter."
732,Sheet Pan Shrimp Oreganata,https://www.skinnytaste.com/wp-content/uploads/2020/12/Sheet-Pan-Shrimp-Oreganata-9-260x390.jpg,"['DF', 'LC', 'Q']",3,333.0,Sheet Pan Shrimp Oreganata is made with jumbo shrimp topped with a light breadcrumb and pecorino mixture baked on a sheet pan for a quick and easy dinner.
733,"Roasted Delicata Squash with Burrata, Pomegranate and Pistachios",https://www.skinnytaste.com/wp-content/uploads/2020/12/Roasted-Delicata-Squash-7-260x390.jpg,"['GF', 'Q', 'V']",5,165.0,"Roasted Delicata Squash with Burrata, Pomegranate and Pistachios has minimal ingredients and just one sheet pan for prep, perfect for your Holiday table or as an easy weeknight side dish."
734,Frenched Rack Of Lamb,https://www.skinnytaste.com/wp-content/uploads/2020/12/Frenched-Rack-of-Lamb-1-2-260x390.jpg,"['DF', 'GF', 'HP', 'KF', 'LC', 'W']",8,335.0,"Tender oven-roasted rack of lamb, seasoned with rosemary, fresh lemon juice, and garlic, is perfect for entertaining and so easy to make!"
735,Pizzelle Cookies,https://www.skinnytaste.com/wp-content/uploads/2020/12/Pizzelle-Cookies-6-2-260x390.jpg,"['GF', 'KF', 'Q']",5,91.0,"Italian Pizzelle Cookies are light and crisp, made lighter with less butter and sugar for a tasty holiday treat. Also works great with gluten-free flour!"
736,Caramelized Onion Empanadas (Chilean pequenes),https://www.skinnytaste.com/wp-content/uploads/2020/12/Caramelized-Onion-Empanadas-9-260x390.jpg,"['FM', 'V']",7,218.0,"Chilean empanadas, also known as pequenes, are stuffed with caramelized onions and seasoned with Latin spices. They make the perfect holiday appetizer."
737,Yogurt Sheet Pan Pancakes with Mixed Berries,https://www.skinnytaste.com/wp-content/uploads/2020/12/Yogurt-Sheet-Pan-Pancakes-8-260x390.jpg,"['KF', 'MP', 'Q', 'V']",6,211.0,Yogurt Sheet Pan Pancakes with Mixed Berries are an easy breakfast or brunch for the holiday season or any time of the year. Set out all the toppings and let your family serve themselves.
738,Angel Hair with Shrimp and Asparagus,https://www.skinnytaste.com/wp-content/uploads/2020/12/Angel-Hair-with-Shrimp-and-Asparagus-6-260x390.jpg,"['DF', 'HF', 'KF', 'Q']",7,434.0,Angel Hair with Shrimp and Asparagus is a quick and easy pasta dish made with fresh tomatoes and asparagus in a light tomato broth.
739,Lemon Cranberry Scones,https://www.skinnytaste.com/wp-content/uploads/2011/03/Lemon-Cranberry-Scones-12-260x390.jpg,[],9,193.0,These Lemon Cranberry Scones studded with dried cranberries are topped with a lemon glaze; a perfect Sunday morning treat.
740,Dark Chocolate Peanut Butter Bark,https://www.skinnytaste.com/wp-content/uploads/2020/12/DARK-CHOCOLATE-PEANUT-BUTTER-BARK-Finals-10-260x390.jpg,"['HF', 'KF', 'V']",6,144.0,"Dark Chocolate Peanut Butter Bark with Sea Salt is so easy to make, just 3 ingredients! It makes a great homemade holiday gift!"
741,Roasted Radishes with Onions,https://www.skinnytaste.com/wp-content/uploads/2020/12/Roasted-Radishes-and-Onions-7-260x390.jpg,"['DF', 'GF', 'LC', 'V', 'W']",1,69.0,"If you don’t love raw radishes, this 5-ingredient recipe for Roasted Radishes and Onions recipe will definitely change your mind!"
742,Butternut Squash Lentil Soup,https://www.skinnytaste.com/wp-content/uploads/2020/11/Lentil-Soup-with-Butternut-and-Kale-4-260x390.jpg,"['DF', 'FM', 'GF', 'HF', 'V']",1,122.0,"Lentil Soup with Butternut and Kale is comforting and nutrient-dense, thanks to the butternut squash, lentils, kale, and leeks."
743,Chicken Brown Rice Bowl (copycat Zinque’s Le Bowl),https://www.skinnytaste.com/wp-content/uploads/2020/11/Zinque_s-Le-Bowl-edit-6-260x390.jpg,"['GF', 'HP', 'HF', 'Q']",7,455.0,"This delicious, Chicken Brown Rice Bowl is an easy one-bowl meal with chicken breast, arugula, avocado, tomatoes, Gruyere with a sriracha yogurt sauce."
744,Sausage Stuffing,https://www.skinnytaste.com/wp-content/uploads/2011/11/Chicken-Sausage-and-Herb-Stuffing-260x390.jpg,"['FM', 'KF']",4,166.0,"This flavorful Sausage Stuffing made with chicken sausage, celery, onions, herbs and french bread is my go-to Thanksgiving stuffing recipe!"
745,Apple Cranberry Crumble,https://www.skinnytaste.com/wp-content/uploads/2011/12/Apple-Cranberry-Crumble_-5-260x390.jpg,"['DF', 'GF', 'KF', 'V']",10,211.0,"Apple Cranberry Crumble is delicious and perfect for your Holiday table! Easier and lighter than making a pie, topped with oats, nuts and a touch of brown sugar."
746,Slow Cooker Butternut Squash Pear Soup,https://www.skinnytaste.com/wp-content/uploads/2020/11/Slow-Cooker-Butternut-Pear-5-260x390.jpg,"['DF', 'FM', 'GF', 'HF', 'SC', 'V', 'W']",2,132.0,This Slow Cooker Butternut Squash Soup with sweet pears a hint of ginger is vegan and dairy-free and so simple to make. Great as a starter or serve it as a meal with a salad or a sandwich.
747,Turkey Pot Pie with Stuffing Crust,https://www.skinnytaste.com/wp-content/uploads/2019/11/Turkey-Pot-Pie-with-Stuffing-Crust-7-260x390.jpg,[],4,390.0,"Turkey Pot Pie with Stuffing Crust is a fun twist on a turkey pot pie, made with diced turkey and veggies simmered in a creamy sauce and finished with a stuffing topping."
748,Smashed Sweet Potatoes,https://www.skinnytaste.com/wp-content/uploads/2020/11/Savory-Smashed-Sweet-Potatoes-7-260x390.jpg,"['GF', 'KF', 'V']",5,206.0,"Smashed Sweet Potatoes, seasoned with thyme are smashed after roasting and then sprinkled with Parmesan for a savory-sweet side dish."
749,Pumpkin Pistachio Energy Balls,https://www.skinnytaste.com/wp-content/uploads/2020/11/Pumpkin-Pistachio-Energy-Balls-5-260x390.jpg,"['DF', 'KF', 'Q', 'V']",4,138.0," Made with cashews, pistachios, dates, pumpkin and spices, these no-bake Pumpkin Pistachio Energy Balls literally taste like little bites of pumpkin pie"
750,Crustless Sausage and Spinach Quiche,https://www.skinnytaste.com/wp-content/uploads/2020/11/Sausage-and-Spinach-Quiche-6-260x390.jpg,"['GF', 'HP', 'KF', 'LC', 'MP']",5,233.0,"This Crustless Sausage and Spinach Quiche with Italian chicken sausage, spinach and cheese is an easy and healthy recipe for breakfast, brunch, or dinner."
751,Meatloaf and Brown Gravy,https://www.skinnytaste.com/wp-content/uploads/2020/10/Meatloaf-and-Gravy-8-260x390.jpg,['KF'],7,278.0,"This Meatloaf and Brown Gravy is a family favorite, this one is made a bit healthier than most, with a mix of half beef and ground turkey plus nutritious oats, topped with a delicious brown gravy – comfort food at its finest!"
752,Air Fryer Herbed Buttermilk Roast Chicken Breast,https://www.skinnytaste.com/wp-content/uploads/2020/10/Air-Fryer-Herbed-Buttermilk-Roast-Chicken-Breast-9-260x390.jpg,"['AF', 'GF', 'HP', 'KF', 'LC']",12,243.0,"Air fryer bone-in, skin-on chicken breast brined in buttermilk and seasoned with a mix of herbs and spices makes for perfectly juicy chicken."
753,Vegetarian Mushroom Kale Lasagna Rolls,https://www.skinnytaste.com/wp-content/uploads/2012/11/Mushroom-Kale-Lasagna-Rolls-11-260x390.jpg,"['FM', 'KF', 'V']",6,258.0,"Mushroom Kale Lasagna Rolls are one of the tastiest ways to enjoy kale! They are quick, easy and perfectly portioned."
754,Slow Cooker Chicken Enchilada Stuffed Sweet Potatoes,https://www.skinnytaste.com/wp-content/uploads/2020/10/Enchilada-Chicken-Stuffed-Sweet-Potatoes-2-4-260x390.jpg,"['GF', 'HF', 'MP', 'SC']",7,413.0,"These Slow Cooker Chicken Enchilada Stuffed Sweet Potatoes made with chicken breast, cheese and enchiladas sauce are an easy one-pot meal!"
755,Honeynut Squash Recipe with Maple and Pecans,https://www.skinnytaste.com/wp-content/uploads/2020/10/Roasted-Maple-Pecan-Honeynut-8-260x390.jpg,"['GF', 'HF', 'KF', 'V']",4,205.0,This Roasted Roasted Honeynut Squash recipe with Maple and Pecans is the perfect fall side dish! Sweeter and smaller than butternut and so much quicker to make.
756,Pastrami Reuben Egg Rolls,https://www.skinnytaste.com/wp-content/uploads/2020/10/Pastrami-Reuban-Eggrolls-7-260x390.jpg,['AF'],8,360.0,"Golden, crisp Pastrami Reuben Egg Rolls with Russian Dressing, made healthier by cooking in the air fryer or baking in the oven, taste so good!"
757,Detox Vegetable Soup,https://www.skinnytaste.com/wp-content/uploads/2020/10/detox-vegetable-soup-5-260x390.jpg,"['DF', 'GF', 'HF', 'KF', 'V']",5,293.0,"This dairy-free, creamy Detox Vegetable Soup is not only easy to make, it’s also LOADED with nutrient-rich goodness!"
758,Pumpkin Pie Dip,https://www.skinnytaste.com/wp-content/uploads/2015/11/Pumpkin-Pie-Dip-5-260x390.jpg,"['GF', 'KF', 'Q', 'V']",5,105.0,"Pumpkin Pie Dip is everything you love about pumpkin pie, made into a easy, light and fluffy no bake dip. Perfect for dipping apple wedges, graham crackers or gingersnaps."
759,Broccoli and Cheese Twice Baked Potatoes,https://www.skinnytaste.com/wp-content/uploads/2013/01/Twice-Baked-Potatoes-with-Broccoli-and-Cheese-2-260x367.jpg,"['GF', 'KF', 'Q', 'V']",3,146.5,"These twice baked potatoes are so cheesy, stuffed with broccoli and cheese plus some hidden cauliflower, but trust me no one will know!"
760,Skinny Pumpkin Snickerdoodles,https://www.skinnytaste.com/wp-content/uploads/2013/09/Skinny-Pumpkin-Spiced-Snickerdoodles-6-260x390.jpg,['KF'],3,51.0,A simple sugar cookie dough is rolled in sugar and pumpkin pie spice to make these soft and chewy Pumpkin Snickerdoodles. They require just 10 minutes of chill time and 5 minutes in the oven!
761,Sweet and Spicy Glazed Salmon,https://www.skinnytaste.com/wp-content/uploads/2020/10/Sweet-and-Spicy-Sheet-Pan-Salmon-6-260x390.jpg,"['AF', 'DF', 'GF', 'LC', 'Q']",2,202.0,"Sweet and Spicy Glazed Salmon is super easy, baked on a sheet pan with a simple glaze made with sweet red chili sauce, sriracha, and ginger."
762,Mushroom Stroganoff,https://www.skinnytaste.com/wp-content/uploads/2012/09/Mushroom-Stroganoff-3-260x390.jpg,"['HF', 'KF', 'Q', 'V']",9,268.0,"This quick and easy Mushroom Stroganoff is made with a mix of shiitake, button and cremini mushrooms with noodles in a light creamy sauce."
763,Lemon Blueberry Buttermilk Sheet Pan Pancakes,https://www.skinnytaste.com/wp-content/uploads/2020/09/Lemon-Blueberry-Buttermilk-Sheet-Pancakes-2-260x390.jpg,"['KF', 'MP', 'Q', 'V']",7,214.0,"This sheet pan pancakes recipe makes it simple to cook up pancakes for a crowd. Flavored with lemon and blueberries, this is essentially a giant pancake baked in the oven. A genius way of making pancakes!"
764,Citrus Immunity Shots,https://www.skinnytaste.com/wp-content/uploads/2020/09/Citrus-Immunity-Booster-6-260x390.jpg,"['DF', 'GF', 'Q', 'V', 'W']",0,25.0,"This super-simple-to-prepare, inexpensive Citrus Immunity Shots made with immune-boosting citrus, turmeric, and garlic, a delicious way to start your day!"
765,Turkey Meatball Tortellini Soup with Spinach,https://www.skinnytaste.com/wp-content/uploads/2014/02/Turkey-Meatball-Spinach-Tortellini-Soup-10-260x390.jpg,['KF'],7,271.0,"This turkey meatball tortellini soup with spinach is an easy, kid-friendly soup and a great way to warm up on a cold winter night. One large bowl is under 300 calories and is very satisfying."
766,Roasted Seasoned Winter Squash Medley,https://www.skinnytaste.com/wp-content/uploads/2015/10/RoastedWinterSquashMedley-260x390.jpg,"['DF', 'GF', 'V', 'W']",3,140.0,"Roasted Seasoned Winter Squash Medley is seasoned with a savory, sweet, spicy and smoky seasoning blend. SO good and a huge hit with my husband!"
767,5 Tips For Organizing Your Refrigerator,https://www.skinnytaste.com/wp-content/uploads/2020/06/Fridge-1-260x390.jpg,[],,,"5 Tips For Organizing Your Refrigerator for easy meal prep to save time and money, so food stays fresh all week."
768,Spicy Pork Brussels Bowls,https://www.skinnytaste.com/wp-content/uploads/2020/09/Spicy-Pork-Brussels-Bowl_-3-260x390.jpg,"['DF', 'FM', 'GF', 'HF', 'LC', 'MP', 'Q', 'W']",6,280.5,"Spicy Pork Brussels Bowls are a delicious low-carb meal, made with shredded brussels sprouts as the base, smoky ground pork, and an egg on top!"
769,Portobello Burger with Mozzarella and Pesto Mayo,https://www.skinnytaste.com/wp-content/uploads/2020/09/Portobello-Mushroom-Burger-6-260x390.jpg,"['HF', 'KF', 'V']",9,229.0,"These grilled Portobello Mushroom Burgers topped with mozzarella, red peppers, and pesto mayo, are delicious and an excellent vegetarian burger option."
770,Dominican Beans (Habichuelas Guisadas),https://www.skinnytaste.com/wp-content/uploads/2020/09/Dominican-Beans-10-260x390.jpg,"['DF', 'FM', 'GF', 'HF', 'KF', 'PC', 'V']",1,158.0,"These creamy Dominican beans, flavored with garlic, onion, cubanelle pepper, and adobo seasoning, cooked in the Instant Pot or pressure cooker, make the perfect vegetarian side or meatless main dish."
771,Sautéed Zucchini with Plum Tomatoes,https://www.skinnytaste.com/wp-content/uploads/2009/08/Sautéed-Zucchini-and-Plum-Tomatoes-6-260x390.jpg,"['GF', 'KF', 'LC', 'Q', 'V', 'W']",2,92.0,Sautéed Zucchini with Plum Tomatoes is a quick and delicious summer side dish made with simple ingredients.
772,Peach Blueberry Crisp,https://www.skinnytaste.com/wp-content/uploads/2009/08/Blueberry-Peach-Crisp-7-260x390.jpg,"['DF', 'GF', 'KF', 'V']",9,203.0,"This Blueberry Peach Crisp is a wonderful summer dessert loaded with fruit, and a lightly sweetened crisp oat topping."
773,Skinnytaste Meal Prep Cookbook: Free Bonus Pack with 3 Exclusive Recipes with Pre-Order,https://www.skinnytaste.com/wp-content/uploads/2020/08/Skinnytaste-Meal-Prep-Bonus-Recipes-1-2-260x390.jpg,[],,,I’m beyond exciting that in just a few short weeks my new cookbook Skinnytaste Meal Prep will finally be hitting bookstores!!
774,Whipped Ricotta Toast with Roasted Tomatoes,https://www.skinnytaste.com/wp-content/uploads/2020/08/Whipped-Ricotta-Toast-10-260x390.jpg,['V'],7,256.0,"Whipped Ricotta Toast with Roasted Tomatoes on crusty bread and topped with garlicky tomatoes, shallots, and basil is the perfect way to enjoy fresh summer tomatoes."
775,Skillet Mexican Zucchini,https://www.skinnytaste.com/wp-content/uploads/2013/08/Mexican-Skillet-Zucchini-260x390.jpg,"['GF', 'LC', 'Q', 'V']",4,102.0,"Skillet Mexican Zucchini is incredibly delicious with a little bit of a kick from the jalapeño topped with melted queso blanco. So easy and quick, a must try!"
776,Raspberry Yogurt Ice Pops,https://www.skinnytaste.com/wp-content/uploads/2020/08/Raspberry-Yogurt-Pops-10-260x390.jpg,"['GF', 'KF', 'V']",3,71.0,"These easy, healthy Raspberry Yogurt Ice Pops, made with just three ingredients, are a wonderful treat on a hot summer day."
777,Cauliflower Gnocchi,https://www.skinnytaste.com/wp-content/uploads/2020/08/Cauliflower-Gnocchi-11-260x390.jpg,"['DF', 'GF', 'HF', 'KF', 'V']",2,228.0,This delicious Cauliflower Gnocchi is made with cauliflower instead of traditional potatoes. No need for a Trader Joe’s run – make them from scratch with just three ingredients!
778,Ratatouille Baked Chicken,https://www.skinnytaste.com/wp-content/uploads/2020/03/Ratatouille-Baked-Chicken-5-260x390.jpg,"['DF', 'GF', 'HP', 'HF', 'KF', 'LC', 'MP']",10,543.0,Ratatouille Baked Chicken takes a classic French dish and turns it into a family-friendly comfort food dish loaded with veggies.
779,Chocolate Zucchini Bread,https://www.skinnytaste.com/wp-content/uploads/2009/08/Chocolate-Zucchini-Bread-7-260x390.jpg,[],8,190.5,This healthy Chocolate Zucchini Bread is so rich and moist that no one will ever know there’s zucchini in it. With walnut in every bite!
780,Spaghetti with Chicken and Grape Tomatoes,https://www.skinnytaste.com/wp-content/uploads/2009/08/Spaghetti-with-Sauteed-Chicken-and-Grape-Tomatoes-3-260x390.jpg,"['GF', 'HF', 'KF', 'Q']",6,330.0,"Spaghetti with Chicken and Grape Tomatoes, a pasta inspired by the abundance of tomatoes and basil in my garden this year."
781,Easy Blueberry Buttermilk Cake,https://www.skinnytaste.com/wp-content/uploads/2012/05/Easy-Blueberry-Buttermilk-Cake-6-260x390.jpg,"['KF', 'V']",8,168.0,"This light and Easy Blueberry Buttermilk Cake loaded with fresh, juicy blueberries in a lightly sweetened, moist buttermilk cake is ideal for summer."
782,Greek Turkey Burgers,https://www.skinnytaste.com/wp-content/uploads/2020/07/Greek-Turkey-Burgers-6-260x390.jpg,"['GF', 'LC', 'MP', 'Q']",8,255.0,"These Greek Turkey Burgers, mixed with Kalamata olives, feta, and spinach,combine all my favorite Greek flavors and can be served with or without the bun."
783,Crustless Quiche Lorraine,https://www.skinnytaste.com/wp-content/uploads/2020/07/Crustless-Quiche-Lorraine-9-260x390.jpg,"['GF', 'KF', 'LC']",5,205.0,"This easy Crustless Quiche Lorraine with bacon and Gruyere is a lighter take on the classic, made lighter without the crust."
784,Flourless Chocolate Zucchini Brownies,https://www.skinnytaste.com/wp-content/uploads/2020/07/Flourless-Zucchini-Brownies-12-260x390.jpg,"['GF', 'KF']",7,179.0,"These Flourless Zucchini Brownies are so fudgy and rich, loaded with chocolate chips plus zucchini which makes them extra moist!"
785,Foil Packet Spice Rubbed Fish with Watermelon Salsa,https://www.skinnytaste.com/wp-content/uploads/2020/06/Foil-Packet-Spice-Rubbed-Fish-with-Watermelon-Salsa-9-260x390.jpg,"['DF', 'GF', 'HP', 'LC', 'Q', 'W']",3,314.0,"Spice Rubbed Fish is zesty and so flavorful, the refreshing watermelon salsa is the perfect compliment. Cooked in foil on the grill or the oven!"
786,Easy Crustless Spinach and Feta Pie,https://www.skinnytaste.com/wp-content/uploads/2018/03/Easy-Crustless-Spinach-and-Feta-Pie-8-260x390.jpg,"['FM', 'KF', 'Q', 'V']",3,126.0,"This Easy Crustless Spinach and Feta Pie is savory and delicious filled with spinach, Feta and Asiago cheese, dill and scallions. Perfect to bring to a potluck!"
787,Air Fryer Fried Shrimp Sandwich with Tartar Sauce,https://www.skinnytaste.com/wp-content/uploads/2020/07/Air-Fryer-Shrimp-Sandwich-9-260x390.jpg,"['AF', 'HF', 'KF']",6,352.0,"Air Fryer Shrimp Sandwich is made with crispy shrimp served on a soft potato bun with lettuce and homemade tartar sauce, the perfect summer sandwich."
788,"Caramelized Onion, Red Pepper and Zucchini Frittata",https://www.skinnytaste.com/wp-content/uploads/2012/03/Caramelized-Onion-Red-Pepper-and-Zucchini-Frittata-14-260x390.jpg,"['GF', 'LC', 'Q', 'V']",2,186.0,"Caramelized onions, sautéed red bell peppers and zucchini mixed with Parmesan creates a easy frittata perfect for breakfast, lunch or dinner!"
789,Salmon Croquettes with Dill Sauce,https://www.skinnytaste.com/wp-content/uploads/2020/07/Salmon-Croquettes-6-260x390.jpg,"['GF', 'KF', 'LC', 'Q']",3,278.0,These low-carb Salmon Croquettes with Dill Sauce are healthier than traditional deep-fried ones and use only egg as a binder rather than breadcrumbs or crackers.
790,Grilled Chicken with Spinach and Melted Mozzarella,https://www.skinnytaste.com/wp-content/uploads/2011/03/Grilled-Chicken-with-Spinach-and-Melted-Mozzarella-10-260x390.jpg,"['GF', 'KF', 'LC', 'Q']",2,195.0,"Grilled chicken topped with spinach, melted mozzarella and roasted peppers – a quick and easy chicken dish your family will love!"
791,Gnocchi with Grilled Chicken in Roasted Red Pepper Sauce,https://www.skinnytaste.com/wp-content/uploads/2020/07/Gnocchi-with-Grilled-Chicken-and-Roasted-Red-Pepper-Sauce-15-260x390.jpg,['KF'],8,377.0,"Gnocchi with Grilled Chicken in a creamy, light roasted red pepper sauce, baby spinach, and Pecorino Romano will make people think you’re a gourmet cook!"
792,The Best Baba Ganoush,https://www.skinnytaste.com/wp-content/uploads/2020/07/Baba-Ghanoush-6-1-260x390.jpg,"['DF', 'GF', 'V', 'W']",3,140.0,"This authentic Baba Ganoush recipe is a smoky Middle Eastern eggplant dip made with charred eggplant, tahini, lemon juice, and olive oil."
793,Stuffed Zucchini with Sausage,https://www.skinnytaste.com/wp-content/uploads/2015/06/Sausage-stuffed-zucchini-boats-260x390.jpg,"['GF', 'KF', 'LC']",7,153.0,"These are the best Stuffed Zucchini Boats filled with Italian chicken sausage, marinara sauce and mozzarella cheese. Perfect for summer zucchini!"
794,Vegetarian Black Bean Tacos,https://www.skinnytaste.com/wp-content/uploads/2020/06/Crunchy-Black-Bean-Tacos-6-260x390.jpg,"['GF', 'HF', 'KF', 'Q', 'V']",8,367.0,Vegetarian Black Bean Tacos served in crunchy corn shells and filled with classic taco toppings are so good that you definitely won’t miss the meat.
795,Grilled Chicken Kabobs with Cucumber Yogurt Sauce,https://www.skinnytaste.com/wp-content/uploads/2020/06/Chicken-Kabobs-9-260x390.jpg,"['GF', 'KF', 'LC']",2,266.0,These Lebanese-inspired Grilled Chicken Kabobs are seasoned with za’atar and served with a cool Laban Cucumber Yogurt Sauce.
796,Beef and Broccoli Recipe,https://www.skinnytaste.com/wp-content/uploads/2020/06/Beef-Broccoli-1-2-1-260x390.jpg,"['DF', 'GF', 'HF', 'KF', 'Q']",7,315.0,This Beef and Broccoli recipe satisfies my craving for Chinese takeout but with less oil and sugar than what you’ll find at most restaurants.
797,Grilled Crab Legs,https://www.skinnytaste.com/wp-content/uploads/2020/06/Grilled-King-Crab-Legs-4-260x390.jpg,"['DF', 'FM', 'GF', 'KF', 'LC', 'Q', 'W']",0,144.0,"Grilled Crab Legs is such a treat in the summer, this foolproof recipe is so easy and works with king crab legs, Dungeness crab legs and snow crab legs!"
798,Zesty Lime Grilled Chicken with Pineapple Salsa,https://www.skinnytaste.com/wp-content/uploads/2020/06/Healthyish-Foods-Grilled-Chicken-Paillard_-260x390.jpg,"['DF', 'GF', 'KF']",4,395.0,"Zesty Lime Grilled Chicken with Pineapple Salsa is made with grilled chicken breasts – fresh and flavorful, perfect for weeknight summer dinners."
799,Jamaican Beef Patties,https://www.skinnytaste.com/wp-content/uploads/2020/06/Jamaican-Beef-Patties-13-260x390.jpg,"['AF', 'FM', 'KF']",6,191.0,"Jamaican Beef Patties are filled with spicy beef, seasoned with paprika and allspice and wrapped in a buttery, yellow crust flavored with turmeric."
800,Skinnytaste Meal Prep: Cookbook Cover Reveal,https://www.skinnytaste.com/wp-content/uploads/2020/06/Skinnytaste-Meal-Prep-Cookbook-1-260x390.jpg,[],,,"I’m beyond thrilled to give you a sneak peak of my fifth cookbook, Skinnytaste Meal Prep: Healthy Make-Ahead Meals and Freezer Recipes to Simplify Your Life: A Cookbook."
801,Boozy Watermelon Lime Granita,https://www.skinnytaste.com/wp-content/uploads/2020/06/Boozy-Watermelon-Lime-Granita-6-260x390.jpg,"['DF', 'FM', 'GF', 'V']",3,109.0,"This Boozy Watermelon Lime Granita is part cocktail, part dessert. The perfect, frozen adult treat for hot summer days."
802,Omelet Tortilla Breakfast Wrap,https://www.skinnytaste.com/wp-content/uploads/2020/06/Spinach-and-Mushroom-Omelet-Wrap-1-260x390.jpg,"['DF', 'HF', 'KF', 'MP', 'Q']",8,315.0,This Omelet Tortilla Breakfast Wrap takes a classic omelet and cooks it with a tortilla right in the skillet. Then simply roll it up and you have an easy on-the-go breakfast.
803,Margherita Pizza,https://www.skinnytaste.com/wp-content/uploads/2020/05/Margherita-Pizza-1-4-260x390.jpg,"['KF', 'V']",6,236.0,"Easy Margherita Pizza made from scratch with my yeast-free, thin crust pizza dough topped with a simple raw tomato sauce, fresh mozzarella cheese, and basil."
804,Banana Pancake Cereal,https://www.skinnytaste.com/wp-content/uploads/2020/05/Healthy-Pancake-Cereal-5-260x390.jpg,"['DF', 'HF', 'KF', 'Q', 'V']",5,272.0,"Mini Pancake Cereal is the latest Tiktok trend, so versatile you can serve them with anything you want! I made them healthier with my banana pancake recipe and topped them with tons of fresh fruit."
805,Turkey Club,https://www.skinnytaste.com/wp-content/uploads/2020/05/Turkey-Club-Sandwich-9-260x390.jpg,"['HF', 'KF', 'Q']",7,351.0,"A classic Turkey Club sandwich made healthy, piled high with turkey breast, bacon, lettuce, and tomato on whole grain bread, the perfect easy lunch."
