,name,image,keys,points,calories,summary
484,Giant Zucchini Parmesan,https://www.skinnytaste.com/wp-content/uploads/2022/07/Giant-Zucchini-Parmesan-9-260x390.jpg,"['AF', 'GF', 'KF', 'V']",5,242.0,"If you have a giant zucchini in your garden and don’t know what to do with it, make this Giant Zucchini Parmesan – it’s so good!"
485,Corn Tomato Avocado Salad,https://www.skinnytaste.com/wp-content/uploads/2018/07/Corn-Tomato-Avocado-Salad-1-9-260x390.jpg,"['DF', 'GF', 'KF', 'Q', 'V']",2,128.0,"This Corn Tomato Avocado Salad is summer in a bowl! The perfect side dish with anything you’re grilling, or double the portion as a main dish."
486,Peach Pie Cottage Cheese Bowls,https://www.skinnytaste.com/wp-content/uploads/2022/07/Peach-Pie-Cottage-Cheese-Bowls-3-260x390.jpg,"['HP', 'Q', 'V']",5,272.0,"Peach Pie Cottage Cheese Bowls is a delicious, high protein breakfast made with fresh, ripe summer peaches."
487,Gandules Guisados (Stewed Pigeon Peas),https://www.skinnytaste.com/wp-content/uploads/2022/07/Gandules-4-260x390.jpg,"['DF', 'FM', 'GF', 'KF', 'Q', 'V']",1,131.0,"Quick and easy recipe for gandules using canned pigeon peas simmered in a tomato-based sauce. An inexpensive, flavorful Latin side dish!"
488,Puerto Rican Sofrito Recipe,https://www.skinnytaste.com/wp-content/uploads/2022/07/Puerto-Rican-Sofrito-5-260x390.jpg,"['DF', 'FM', 'GF', 'LC', 'Q', 'V', 'W']",0,27.0,"This Puerto Rican Sofrito recipe is the base for so many dishes, like soups, stews, roast pork, bistec, and beans, made with fresh cilantro, garlic, onions, bell peppers, and other ingredients."
489,Pollo Sabroso (Broiled or Grilled),https://www.skinnytaste.com/wp-content/uploads/2010/06/Pollo-Sabroso-9-260x390.jpg,"['DF', 'GF', 'KF', 'LC', 'W']",5,181.0,My family’s favorite chicken recipe is this Broiled or Grilled Pollo Sabroso seasoned with Latin flavors to create the most delicious grilled chicken thighs.
490,"Summer Cavatelli Pasta with Corn, Tomatoes and Zucchini",https://www.skinnytaste.com/wp-content/uploads/2017/07/Summer-Cavatelli-with-Corn-Tomatoes-and-Zucchini-8-260x390.jpg,"['KF', 'Q', 'V']",7,297.5,"This summer pasta dish is fresh and delicious, made with sweet summer corn, cherry tomatoes, zucchini, basil and cavatelli pasta."
491,Bacon-Wrapped Air Fryer Chicken Breast,https://www.skinnytaste.com/wp-content/uploads/2022/07/Air-Fryer-Bacon-Wrapped-Chicken-Breast-3-260x390.jpg,"['AF', 'DF', 'GF', 'HP', 'KF', 'LC', 'Q', 'W']",6,332.0,Want the juiciest chicken breasts? Make this easy Bacon-Wrapped Air Fryer Chicken Breast recipe! Just 2 ingredients not counting salt and pepper!
492,"Black Bean, Avocado, Cucumber and Tomato Salad",https://www.skinnytaste.com/wp-content/uploads/2010/07/Black-Bean-Avocado-Cucumber-and-Tomato-Salad-4-260x390.jpg,"['DF', 'GF', 'Q', 'V']",1,94.0,"A little lime and cilantro make this Black Bean, Avocado, Cucumber, and Tomato Salad a perfect companion for air fryer chicken breast, grilled chicken or steak. You can also serve this with chips as a dip, or serve it over grilled salmon."
493,Greek 7 Layer Dip,https://www.skinnytaste.com/wp-content/uploads/2015/06/Greek-7-Layer-Dip-7-260x390.jpg,"['LC', 'Q', 'V']",2,93.0,"This 7 Layer Greek Dip is layered with hummus, garlic-lemon Greek yogurt topped with cucumbers, tomatoes, red onions, feta, and kalamata olives. Grab some pita chips and serve it at your next party!"
494,"Red, White and Blueberry Trifle",https://www.skinnytaste.com/wp-content/uploads/2015/06/red-white-and-blueberry-trifle-260x390.jpg,"['KF', 'V']",7,158.0,"A heavenly mixed berry trifle made with fresh summer blueberries and strawberries, white chocolate pudding, angel food cake, and whipped cream."
495,Air Fryer Baked Potato,https://www.skinnytaste.com/wp-content/uploads/2022/06/Air-Fryer-Baked-Potato_1-2-260x390.jpg,"['AF', 'DF', 'GF', 'KF', 'V', 'W']",4,157.0,"Air Fryer Baked Potatoes with crispy, salted skins and fluffy insides turn out perfectly at a fraction of the time it would take in the oven."
496,Chickpea Milanese,https://www.skinnytaste.com/wp-content/uploads/2022/06/Chickpea-Milanese-5-260x390.jpg,"['DF', 'GF', 'HF', 'Q', 'V']",7,320.0,"Vegetarian Chickpea Milanese made with a chickpea flour cutlet topped with arugula salad with canned chickpeas, tomatoes, and fresh lemon."
497,Peruvian Grilled Chicken Skewers,https://www.skinnytaste.com/wp-content/uploads/2022/06/Peruvian-Grilled-Chicken-11-260x390.jpg,[],6,289.0,"These Peruvian Grilled Chicken Skewers with Avocado Aji Verde Sauce are my favorite, so flavorful and great for summer grilling!"
498,Overnight Oats (How To Make),https://www.skinnytaste.com/wp-content/uploads/2012/06/Skinny-Overnight-Oats-in-a-Jar-260x390.jpg,"['DF', 'GF', 'HF', 'MP', 'Q', 'V']",2,236.0,"This easy overnight oats recipe is a fiber-rich, healthy breakfast that you can make ahead for busy mornings! The best part, there’s no cooking required!"
499,Broiled Fish with Tomato Caper Sauce,https://www.skinnytaste.com/wp-content/uploads/2009/03/Broiled-Tilapia-with-Tomato-Caper-Sauce-5-260x390.jpg,"['DF', 'GF', 'KF', 'LC', 'Q']",3,257.0,"Broiled Fish with Tomato Caper Sauce is an easy fish recipe with fresh tomatoes, garlic, shallots and capers that’s ready in under 20 minutes."
500,Mango Coconut Chia Pudding,https://www.skinnytaste.com/wp-content/uploads/2012/06/Mango-Coconut-Chia-Pudding-6-260x390.jpg,"['DF', 'GF', 'HF', 'KF', 'V']",5,227.0,"This Mango Coconut Chia Pudding is made with coconut milk, almond milk, chia seeds, shredded coconut and mango; a delicious breakfast, snack or dessert loaded with protein, fiber and omega-3!"
501,Grilled Chicken Chickpea Salad,https://www.skinnytaste.com/wp-content/uploads/2022/05/Grilled-Chicken-Feta-Chickpea-Salad-6-260x390.jpg,"['GF', 'HP', 'HF', 'MP', 'Q']",6,462.0,"Grilled Chicken Chickpea Salad is a fresh and simple high-protein lunch that can be eaten cold on the go at work, the beach, or anywhere else you’re headed this summer."
502,Grilled Tuna over Arugula with Lemon Vinaigrette,https://www.skinnytaste.com/wp-content/uploads/2011/06/Grilled-Tuna_-5-260x390.jpg,"['LC', 'Q']",1,298.0,"Grilled Tuna over Arugula with Lemon Vinaigrette is a light summer meal made with a few simple ingredients, ready in under 10 minutes."
503,Watermelon Arugula and Feta Salad,https://www.skinnytaste.com/wp-content/uploads/2011/07/Watermelon-and-Feta-Salad-6-260x390.jpg,"['GF', 'KF', 'Q', 'V']",5,157.5,"Watermelon Arugula and Feta Salad is a refreshing summer salad, I love the saltiness of the feta paired with sweet watermelon and peppery arugula!"
504,Berry Cottage Cheese Breakfast Bowl,https://www.skinnytaste.com/wp-content/uploads/2022/06/Very-Berry-Cottage-Cheese-Bowl-10-260x390.jpg,"['GF', 'HP', 'HF', 'MP', 'Q', 'V']",4,232.0,"This high-protein Cottage Cheese Breakfast Bowl is loaded with fresh berries and slivered almonds, a great way to start the day!"
505,Chili-Lime Air Fryer Salmon,https://www.skinnytaste.com/wp-content/uploads/2022/05/Chili-_-Lime-Air-Fryer-Salmon-6-260x390.jpg,"['AF', 'DF', 'GF', 'HP', 'LC', 'Q']",0,262.0,This Chili-Lime Air Fryer Salmon is seasoned with a blend of spices for maximum flavor that cooks in under 10 minutes.
506,String Beans with Garlic and Oil,https://www.skinnytaste.com/wp-content/uploads/2009/05/String-Beans-with-Garlic-and-Oil-5-260x390.jpg,"['GF', 'KF', 'LC', 'Q', 'V']",2,99.0,"This garlic green bean recipe is a quick, healthy side dish for all you garlic lovers."
507,Tuna Poke Salad,https://www.skinnytaste.com/wp-content/uploads/2022/05/Poke-Salad-10-260x390.jpg,"['DF', 'HP', 'HF', 'LC', 'Q']",5,404.0,I’ll be making this high-protein Tuna Poke Salad with Wasabi-Soy Vinaigrette all summer long!
508,Arugula Pasta Salad with Chickpeas and Sun Dried Tomatoes (no mayo),https://www.skinnytaste.com/wp-content/uploads/2012/02/Penne-Arugula-Salad-with-Sun-Dried-Tomatoes-4-260x390.jpg,"['GF', 'HF', 'KF', 'Q', 'V']",7,280.0,"With spicy arugula, canned chickpeas, sun dried tomatoes, shaved Parmesan and balsamic vinegar, this pasta salad is fresh and delicious and made with no mayo."
509,Honey Sriracha Chicken and Broccoli Meal Prep Bowls,https://www.skinnytaste.com/wp-content/uploads/2019/05/Honey-Sriracha-Chicken-and-Broccoli-Meal-Prep-Bowls-10-260x390.jpg,"['DF', 'FM', 'GF', 'MP', 'Q']",7,428.0,"This easy meal-prep honey-sriracha chicken and broccoli dish, which can also be served as a main dish, is made on a sheet pan and comes together quick!"
510,Greek Pasta Salad,https://www.skinnytaste.com/wp-content/uploads/2019/06/Greek-Pasta-Salad-6-260x390.jpg,"['GF', 'KF', 'Q', 'V']",5,176.0,"This Greek Pasta Salad is light and fresh, loaded with garden tomatoes, bell peppers and cucumbers tossed in a homemade Greek dressing with Kalamata olives and Feta cheese. Perfect for summer parties or potlucks!"
511,Sous Vide Chicken Breast and a Cilantro Lime Chicken Avocado Salad,https://www.skinnytaste.com/wp-content/uploads/2022/04/Sous-Vide-Chicken-14-1-260x390.jpg,"['DF', 'HP', 'LC', 'MP', 'W']",4,329.0,"This zesty Sous Vide Chicken Salad is fresh and delicious, made with the juiciest chicken breast, avocados, lime juice, and cilantro – and no mayo!"
512,Instant Pot Baked Oatmeal Bars,https://www.skinnytaste.com/wp-content/uploads/2022/05/Instant-Pot-Banana-Bread-Oatmeal-Bars-9-260x390.jpg,"['DF', 'GF', 'HF', 'MP', 'PC', 'V']",5,266.0,"Banana bread oatmeal in the Instant Pot? Yes! With this Instant Pot Baked Oatmeal Bars recipe, you can make oatmeal breakfast bars with just a few minutes of hands-on time. They’re a delicious breakfast/brunch or dessert, and perfect for meal prep!"
513,"Seared Scallop Salad with Grapefruit, Arugula and Spinach",https://www.skinnytaste.com/wp-content/uploads/2011/03/Seared-Scallops-Grapefruit-Arugula-and-Spinach-Salad-4-1-260x390.jpg,"['DF', 'GF', 'LC', 'Q', 'W']",3,217.0,Seared scallops with pink grapefruit are wonderful over greens with a champagne vinaigrette as a light salad for lunch or dinner!
514,Burst Tomato Cottage Cheese Caprese Bowl,https://www.skinnytaste.com/wp-content/uploads/2022/05/Burst-Tomato-Cottage-Cheese-Caprese-Bowl-9-260x390.jpg,"['AF', 'HP', 'MP']",6,245.0,"Burst Tomato Cottage Cheese Caprese Bowl is an easy, savory, high protein lunch that doesn’t require heating up!"
515,Blueberry Frozen Yogurt,https://www.skinnytaste.com/wp-content/uploads/2022/05/Blueberry-Frozen-Yogurt-8-260x390.jpg,"['GF', 'KF', 'V']",2,76.0,"Blueberry Frozen Yogurt, made with only five ingredients, including fresh blueberries, is slightly tart and delicious! Make this in your ice cream maker or a Ninja Creami."
516,Buffalo Chicken Salad,https://www.skinnytaste.com/wp-content/uploads/2022/05/Buffalo-Chicken-Salad-4-260x390.jpg,"['DF', 'MP']",7,359.0,This easy Buffalo Chicken Salad recipe can be made ahead for lunches throughout the week. Great on lettuce wraps or a sandwich!
517,Coconut Chicken Salad with Warm Honey Mustard Vinaigrette,https://www.skinnytaste.com/wp-content/uploads/2011/03/Coconut-Chicken-Salad-6-260x390.jpg,"['GF', 'KF', 'Q']",8,397.0,"Warm oven-fried crispy coconut chicken strips over a bed of baby greens, cucumber, tomato, and shredded carrots topped with a warm honey mustard vinaigrette – the perfect mix of salty and sweet and hot and cold."
518,Grilled Vegetable Orzo Pasta Salad,https://www.skinnytaste.com/wp-content/uploads/2021/05/Farmer_s-Market-Orzo-Salad-8-260x390.jpg,"['DF', 'KF', 'MP', 'V']",7,267.0,"Grilled vegetables from the farmers market shine in this vegetarian orzo pasta salad, perfect as a side dish or meatless main."
519,Juicy Turkey Burgers with Zucchini,https://www.skinnytaste.com/wp-content/uploads/2015/05/TurkeyZucchiniBurger-260x390.jpg,"['AF', 'DF', 'FM', 'GF', 'KF', 'LC']",4,161.0,My trick to making the juiciest turkey burgers EVER is to add grated zucchini! A huge bonus if you want your kids to eat more veggies! (It’s also an easy Air fryer recipe!)
520,Italian Turkey Meatballs,https://www.skinnytaste.com/wp-content/uploads/2008/12/Skinny-Italian-Turkey-Meatballs-9-260x390.jpg,"['FM', 'GF', 'HF', 'KF']",5,280.0,"We love these juicy, Italian turkey meatballs in homemade tomato sauce. Serve them over your favorite pasta, pizza or sandwich!"
521,"Grilled Chicken Tacos with Lettuce Slaw, Avocado and Cotija",https://www.skinnytaste.com/wp-content/uploads/2015/04/Grilled-Chicken-Tacos-1-5-260x390.jpg,"['HF', 'KF', 'Q']",8,330.0,"Grilled chicken tacos piled high with a simple lettuce-tomato slaw, avocado, and Cotija cheese on a charred tortilla are a quick weeknight dinner solution!"
522,Lemon Asparagus Couscous Salad with Tomatoes,https://www.skinnytaste.com/wp-content/uploads/2013/05/Lemon-Asparagus-Couscous-Salad-with-Tomatoes-5-260x390.jpg,"['DF', 'HF', 'Q', 'V']",4,170.0,"Lemon Asparagus Couscous Salad with Tomatoes makes a vibrant Spring pasta salad, perfect to bring to a potluck or to serve as a BBQ side dish."
523,Latin Yellow Rice,https://www.skinnytaste.com/wp-content/uploads/2008/10/Latin-Yellow-Rice-6-260x390.jpg,"['DF', 'FM', 'GF', 'KF', 'Q', 'V']",6,199.0,We are big rice eaters in my house and one of my specialties is Latin yellow rice! This is a delicious side dish for any chicken or meat dish!
524,Slow Cooker Chicken Tacos,https://www.skinnytaste.com/wp-content/uploads/2020/04/Slow-Cooker-Chicken-Tacos-6-260x390.jpg,"['DF', 'GF', 'HF', 'KF', 'SC']",6,474.0,"These easy Slow Cooker Chicken Tacos made in the crock pot with chicken breast, salsa, and spices are on repeat in my house!"
525,Spicy Canned Salmon Rice Bowl,https://www.skinnytaste.com/wp-content/uploads/2022/04/Spicy-Canned-Salmon-Salad-Bowl-8-260x390.jpg,"['DF', 'GF', 'HP', 'MP', 'Q']",6,389.0,"This quick and easy Sushi-inspired Spicy Canned Salmon Rice Bowl makes an easy high protein, budget-friendly, 5-minute lunch, great for meal prep!"
526,Avocado Quinoa Salad,https://www.skinnytaste.com/wp-content/uploads/2022/04/Avocado-Quinoa-Salad-3-260x390.jpg,"['DF', 'GF', 'HF', 'MP', 'Q', 'V']",9,443.0,"Avocado Quinoa Salad is fresh and flavorful, made with cucumbers, tomato, red onion, cilantro and lime juice. A great plant-based lunch or side dish!"
527,Swiss Chard Frittata,https://www.skinnytaste.com/wp-content/uploads/2012/02/Swiss-Chard-Frittata-8-260x390.jpg,"['GF', 'HF', 'LC', 'V']",1,139.0,"Swiss Chard Frittata is made with sweet caramelized onions, Swiss chard, eggs and cheese, perfect for breakfast or brunch."
528,Salmon Tikka Masala,https://www.skinnytaste.com/wp-content/uploads/2022/04/Salmon-Tikka-Masala-8-260x390.jpg,"['DF', 'GF', 'HP', 'LC', 'Q', 'W']",2,283.0,"This delicious Salmon Tikka Masala, an Indian-inspired dish is simmered in a creamy tomato sauce with coconut milk and spices, perfect served with naan, roti, or over rice."
529,"Warm Salad with Artichoke Hearts, Roasted Peppers, Mozzarella",https://www.skinnytaste.com/wp-content/uploads/2022/04/Warm-Salad-with-Artichoke-Hearts-Roasted-Peppers-and-Mozzarella-9-260x390.jpg,"['GF', 'HF', 'Q', 'V']",10,339.0,"This Warm Salad with sauteed Artichoke Hearts, Roasted Peppers, and fresh Mozzarella with balsamic is served over cold, crunchy romaine lettuce. Great for lunch or dinner!"
530,Air Fryer Empanadas,https://www.skinnytaste.com/wp-content/uploads/2017/09/Air-Fryer-Beef-Empanadas-8-260x390.jpg,"['AF', 'DF', 'KF', 'Q']",6,183.0,"These easy Air Fryer Empanadas are filled with homemade beef picadillo – they come out crispy and delicious, much healthier than deep frying!"
531,"Instant Pot Risotto with Prosciutto, Peas, and Herbs",https://www.skinnytaste.com/wp-content/uploads/2022/04/Instant-Pot-Prosciutto-Pea-and-Herb-Risotto-8-1-260x390.jpg,"['GF', 'PC', 'Q']",10,329.0,"This Instant Pot Risotto recipe is the quickest, easiest way to make risotto. It ends up perfectly creamy every time and it’s ready in just 20 minutes."
532,Brown Sugar Baked Beans,https://www.skinnytaste.com/wp-content/uploads/2018/04/Instant-Pot-Brown-Sugar-Baked-Beans-3-260x390.jpg,"['DF', 'GF', 'KF', 'PC', 'SC', 'V']",3,156.0,"Healthier Brown Sugar Baked Beans are a side dish with all the hearty baked bean flavors you love. Slow cooker, Instant Pot, and oven directions are provided."
533,Chocolate Frozen Yogurt in the Ninja™ CREAMi®,https://www.skinnytaste.com/wp-content/uploads/2022/04/Chocolate-Frozen-Yogurt-17-260x390.jpg,"['GF', 'KF', 'LC', 'V']",4,88.0,"Whip up this delicious Chocolate Frozen Yogurt from scratch any night of the week! Simply prep your base, freeze overnight, process, and enjoy!"
534,Lemon Cheesecake Yogurt Cups,https://www.skinnytaste.com/wp-content/uploads/2011/05/Lemon-Cheesecake-Yogurt-Cups-8-260x390.jpg,"['KF', 'V']",5,108.0,"These lemon cheesecake cups are made with cream cheese, Greek yogurt and fresh berries. The “crust” is vanilla wafer cookies, so easy to make!"
535,Blackened Shrimp and Grits,https://www.skinnytaste.com/wp-content/uploads/2022/04/Blackened-Shrimp-with-Cheesy-Grits-9-260x390.jpg,"['GF', 'KF']",7,349.0,"The grits in this Blackened Shrimp and Grits recipe is creamy and cheesy, a delicious dinner for any night of the week."
536,Banana Nut Pancakes,https://www.skinnytaste.com/wp-content/uploads/2010/09/BANANA-NUT-PANCAKES-19-of-15-260x390.jpg,"['KF', 'MP', 'Q', 'V']",3,146.0,Whole wheat banana nut pancakes taste like banana bread but in pancake form – the perfect breakfast for banana and pancake lovers!
537,"Fun in the Sun at Anna Maria Island, Florida",https://www.skinnytaste.com/wp-content/uploads/2022/04/anna-maria-5-260x390.jpg,[],,,Anna Maria Island is known for its beautiful beach coastline along Florida’s Gulf coast.
538,Air Fryer Steak,https://www.skinnytaste.com/wp-content/uploads/2022/03/Air-Fryer-Steak-6-260x390.jpg,"['AF', 'DF', 'GF', 'HP', 'KF', 'LC', 'Q', 'W']",4,221.0,Make perfect Air Fryer Steak that is seared on the outside and juicy on the inside. Air frying steak is quick and easy with no splatter or mess in the kitchen!
539,Peanut Butter Breakfast Oatmeal Bowl,https://www.skinnytaste.com/wp-content/uploads/2022/03/Peanut-Butter-Breakfast-Oatmeal-Bowl-8-260x390.jpg,"['DF', 'HF', 'KF', 'Q', 'V']",6,389.0,"This Peanut Butter Breakfast Oatmeal Bowl is a healthy breakfast in a bowl.  It’s colorful, loaded with fiber and protein, and sweetened naturally with fruit."
540,Greek Turkey Meatballs,https://www.skinnytaste.com/wp-content/uploads/2010/08/Greek-Turkey-Meatballs-9-260x390.jpg,"['FM', 'GF', 'KF', 'MP', 'Q']",7,254.0,"Greek Turkey Meatballs with grated zucchini are delicious with tzatziki sauce (cucumber yogurt sauce) over rice, with chickpea salad, or as an appetizer. Great for meal prep too!"
541,Blackened Fish with Key Lime Tartar,https://www.skinnytaste.com/wp-content/uploads/2022/03/Blackened-Fish-with-Key-Lime-Tartar-8-260x390.jpg,"['AF', 'GF', 'HP', 'KF', 'Q']",7,374.0,"Blackened Fish with Key Lime Tartar Sauce is ridiculously delicious, inspired by my vacation to the Florida Keys. Bake the fish in the oven or air fryer!"
542,BBQ Chicken Salad,https://www.skinnytaste.com/wp-content/uploads/2015/08/BBQ-Chicken-Salad-6-260x390.jpg,"['GF', 'KF', 'MP', 'Q']",2,241.0,"This delicious BBQ Chicken Salad with Ranch is easy, takes less than 15 minutes to make – the perfect for lunch or a light dinner."
543,Roasted Strawberry Banana Bread,https://www.skinnytaste.com/wp-content/uploads/2013/06/Strawberry-Banana-Bread-6-260x390.jpg,"['KF', 'V']",4,88.0,"This Strawberry Banana Bread recipe is moist and delicious, made with ripe bananas and roasted strawberries, which brings out the sweetness of the berries."
544,Spinach Artichoke Lasagna Roll-ups,https://www.skinnytaste.com/wp-content/uploads/2022/03/Spinach-and-Artichoke-Lasagna-Roll-Ups-10-260x390.jpg,"['FM', 'GF', 'KF', 'MP', 'V']",7,250.0,Go meatless with these tasty Spinach Artichoke Lasagna Roll-ups! They’re much faster to make and bake than a traditional lasagna. They are also great for meal prep and freezing.
545,Ginger Scallion Fish,https://www.skinnytaste.com/wp-content/uploads/2022/03/Ginger-Scallion-Fish-5-260x390.jpg,"['DF', 'GF', 'HP', 'LC', 'Q', 'W']",3,229.0,"Ginger Scallion Fish recipe made with broiled flaky, white fish topped with a flavorful Ginger Scallion Sauce – ready in 15 minutes."
546,Air Fryer Chickpeas,https://www.skinnytaste.com/wp-content/uploads/2022/03/Air-Fryer-Chickpeas-8-260x390.jpg,"['AF', 'DF', 'GF', 'HF', 'KF', 'Q', 'V']",0,196.0,"Crispy Air Fryer Chickpeas are a healthy, high fiber snack or salad topper! So quick and easy to make in the air fryer."
547,Mushroom Risotto,https://www.skinnytaste.com/wp-content/uploads/2009/10/Mushroom-Risotto_1-4-260x390.jpg,"['GF', 'Q', 'V']",11,333.0,Mushroom Risotto is creamy Italian rice dish made with Arborio rice and loaded with mushrooms. A vegetarian dish that is comfort in a bowl!
548,High-Protein Scrambled Eggs with Cottage Cheese,https://www.skinnytaste.com/wp-content/uploads/2022/03/High-Protein-Scrambled-Eggs-9-260x390.jpg,"['HP', 'KF', 'LC', 'Q', 'V']",1,173.0,Add some cottage cheese to your scrambled eggs for an easy high-protein breakfast. The results are fluffy eggs with over 17 grams of protein per serving!
549,Sloppy Joe Recipe,https://www.skinnytaste.com/wp-content/uploads/2010/10/Skinny-Sloppy-Joe_s-9-260x390.jpg,"['DF', 'GF', 'KF', 'MP', 'Q']",4,122.0,"This delicious Sloppy Joe recipe is family-friendly, made with ground beef and some hidden minced veggies – great for those picky eaters!"
550,Tuna Croquettes (Baked or Air Fryer),https://www.skinnytaste.com/wp-content/uploads/2022/03/Tuna-Croquettes-8-260x390.jpg,"['AF', 'DF', 'GF', 'HP', 'KF', 'MP', 'Q']",4,215.0,"Tuna Croquettes are budget-friendly, made with pantry staple canned tuna, potato, and dill that’s breaded and baked in the oven or air fryer."
551,Ground Turkey Taco Skillet,https://www.skinnytaste.com/wp-content/uploads/2022/03/Turkey-Taco-Skillet-6-260x390.jpg,"['GF', 'HF', 'KF', 'Q']",11,503.0,"Ground Turkey Taco Skillet, an easy one-pan weeknight dinner using ground turkey, corn, pinto beans and salsa topped with tortilla chips and cheese."
552,Enchilada Turkey Meatloaf,https://www.skinnytaste.com/wp-content/uploads/2022/03/Enchilada-Turkey-Meatloaf-5-260x390.jpg,"['FM', 'GF', 'HP', 'KF']",6,268.0,"If you love turkey meatloaf and enchiladas, you’ll love this Enchilada Turkey Meatloaf, a fun twist on the weeknight classic."
553,Homemade Italian Turkey Sausage or Chicken Sausage,https://www.skinnytaste.com/wp-content/uploads/2010/01/Homemade-Turkey-Sausage-6-260x390.jpg,"['DF', 'FM', 'GF', 'KF', 'LC', 'MP', 'Q', 'W']",5,129.4,"Although you can usually find Italian Turkey Sausage or Chicken Sausage in most supermarkets, after many requests I created this homemade version."
554,Escarole and Chickpea Soup with Garlic Toast,https://www.skinnytaste.com/wp-content/uploads/2022/02/Garlicky-Escarole-and-Chickpea-Soup-with-Garlic-Toast-5-260x390.jpg,"['FM', 'HF', 'Q', 'V']",3,222.0,"If you’re looking for a healthy and filling vegetarian soup that’s quick, cheap and easy, this Escarole and Chickpea Soup is it."
555,Cajun Fried Rice,https://www.skinnytaste.com/wp-content/uploads/2022/02/Cajun-Fried-Rice-7-260x390.jpg,"['DF', 'GF', 'HF', 'KF', 'Q']",10,501.0,"Cajun Fried Rice is a fun take on fried rice with all the familiar comforts of the classic takeout dish, plus the addictive flavors of Cajun cuisine."
556,Peanut Butter Oatmeal Protein Cookies,https://www.skinnytaste.com/wp-content/uploads/2022/02/Peanut-Butter-Banana-Oat-Breakfast-Cookies-8-1-260x390.jpg,"['FM', 'GF', 'HP', 'HF', 'KF', 'V']",7,304.0,"These healthy, Peanut Butter Oatmeal Protein Cookies are made with bananas, oats and chocolate chips PLUS protein powder, peanut butter and egg added for protein."
557,Meal Prep Breakfast Taco Scramble,https://www.skinnytaste.com/wp-content/uploads/2018/02/meal-prep-breakfast-taco-1-2-260x390.jpg,"['FM', 'GF', 'KF', 'MP', 'W']",5,450.0,"A healthy Meal Prep Breakfast Taco Scramble, made with potatoes, turkey taco meat, scrambled eggs and salsa (cheese is optional!), perfect to make ahead for breakfast for the week!"
558,Easiest Salsa Verde Chicken (Slow cooker or Instant Pot),https://www.skinnytaste.com/wp-content/uploads/2013/04/Crockpot-Salsa-Verde-Chicken-5-260x390.jpg,"['FM', 'GF', 'HP', 'KF', 'LC', 'PC', 'SC', 'W']",0,167.0,"This is the easiest Salsa Verde Chicken recipe made in the slow cooker or Instant Pot, perfect for tacos, tostadas, bowls, and more!"
559,Lobster Bisque,https://www.skinnytaste.com/wp-content/uploads/2022/02/Healthy-Lobster-Bisque-9-260x390.jpg,"['FM', 'GF', 'KF']",5,203.0,"If you love lobster bisque, you’ll love this lighter, healthier version made with no cream, it’s creamy from pureeing the vegetable base."
560,Brothy Lima Beans and Greens (Stove or Instant Pot),https://www.skinnytaste.com/wp-content/uploads/2022/02/Brothy-Beans-and-Greens-7-260x390.jpg,"['DF', 'GF', 'HF', 'MP', 'PC']",2,299.0,"Somewhere between a thick stew and soup, these Brothy Lima Beans and Greens are hearty comfort food and budget friendly. Stove and Instant Pot."
561,Food Cart-Style Chicken Salad with White Sauce,https://www.skinnytaste.com/wp-content/uploads/2019/01/Street-Cart-Style-Chicken-Salad-with-White-Sauce-8-260x390.jpg,"['GF', 'KF', 'LC', 'MP']",8,345.0,Halal Food Cart inspired chicken made with boneless chicken thighs served over a big salad of lettuce and tomatoes drizzled with a yummy white sauce.
562,Chicken Breast with Hot Cherry Peppers,https://www.skinnytaste.com/wp-content/uploads/2022/02/Chicken-with-Hot-Cherry-Peppers-3-260x390.jpg,"['DF', 'HP', 'Q']",3,347.0,This spicy chicken breast recipe gets its heat from the Hot Cherry Peppers that cook in garlic white wine sauce.
563,3-Ingredient Strawberries Romanoff,https://www.skinnytaste.com/wp-content/uploads/2019/04/Skinny-Strawberries-Romanoff-7-260x390.jpg,"['GF', 'KF', 'LC', 'Q', 'V']",3,79.0,"Strawberries Romanoff is a quick and easy, no-bake 3-ingredient dessert, delicious and perfect for any night of the week!"
